<?xml version="1.0" encoding="UTF-8"?>
<!-- XML con la configuraci칩n del servidor.

configuracion_servidor:
  |__ base_datos
  |__ backups

base_datos debe incluir:
    - nombre de la base de datos (atributo)
    - usuario
    - contrase침a
    - puerto
    - m치ximo de conexiones
    - modo de acceso

- seccion de backups que contenga a su vez: 
    - ruta
    - frecuencia
-->
<configuracion_servidor
    xmlns:xsi="http://www.w3.org/2001/XMLSchema-instance"
    xsi:noNamespaceSchemaLocation="conf_schema.xsd"
>
  <!-- Configuraci칩n para la base de datos de pruebas-->
  <base_datos nombre="BD_Pruebas">
    <usuario>pepe</usuario>
    <password> <![CDATA[admin1234]]></password>
    <puerto>3000</puerto>
    <max_conexiones>1000</max_conexiones>
    <modo_acceso>remoto</modo_acceso>
  </base_datos>
  <base_datos nombre="BD_Proteccion">
    <usuario>pepe</usuario>
    <password> <![CDATA[admin1234]]></password>
    <puerto>3024</puerto>
    <max_conexiones>1000</max_conexiones>
    <modo_acceso>remoto</modo_acceso>
  </base_datos>
  <backups>
    <ruta>/var/backup</ruta>
    <frecuencia>semanal</frecuencia>
  </backups>
</configuracion_servidor>
